{
  "provenance": {
    "timestamp_utc": "2025-08-20T22:30:00Z",
    "git_sha": "abc123def456"
  },
  "inputs": {
    "omega_log": 145,
    "omega_units": "meV",
    "lambda": 2.6,
    "mu_star": 0.10,
    "f_omega": 1.2
  },
  "derived": {
    "omega_log_K": 1682.65,
    "denominator": 1.988
  },
  "results": {
    "Tc_K": 339.44
  },
  "status": "ok"
}
